Parameter,Value,Unit,Min,Max,Description
"powerRange","100","W","1","120","Optimal average power for Alumina surface cleaning without thermal damage"
"wavelength","1064","nm","355","10640","Near-IR wavelength providing good absorption in Alumina with minimal reflection"
"spotSize","50","μm","0.1","500","Beam spot diameter for effective cleaning resolution and energy density"
"repetitionRate","50","kHz","1","200","Optimal repetition rate balancing cleaning efficiency and thermal management"
"fluenceThreshold","2.5","J/cm²","0.3","4.5","Minimum fluence required for effective Alumina surface cleaning"
"pulseWidth","10","ns","0.1","1000","Nanosecond pulse duration for efficient material removal with controlled thermal effects"
"scanSpeed","500","mm/s","10","5000","Optimal scanning speed for uniform cleaning coverage"
"passCount","3","passes","1","10","Recommended number of passes for complete contaminant removal"
"overlapRatio","50","%","10","90","Optimal beam overlap for uniform cleaning without excessive thermal buildup"