Parameter,Value,Unit,Min,Max,Description
"powerRange","100","W","1","120","Optimal average power for CFRP cleaning without matrix damage"
"wavelength","1064","nm","355","10640","Near-IR wavelength for optimal carbon absorption and minimal polymer damage"
"spotSize","50","μm","0.1","500","Focused spot size for precise cleaning resolution"
"repetitionRate","100","kHz","1","200","High repetition rate for efficient cleaning with thermal management"
"energyDensity","5","J/cm²","0.1","20","Fluence threshold for effective contaminant removal without CFRP damage"
"pulseWidth","10","ns","0.1","1000","Nanosecond pulse duration for controlled ablation of contaminants"
"scanSpeed","500","mm/s","10","5000","Optimal scanning speed for uniform cleaning coverage"
"passCount","3","passes","1","10","Recommended number of passes for complete contaminant removal"
"overlapRatio","50","%","10","90","Optimal beam overlap for uniform cleaning without excessive heating"