Parameter,Value,Unit,Min,Max,Description
"powerRange","100","W","1","120","Optimal average power for CMC surface contaminant removal without substrate damage"
"wavelength","1064","nm","355","10640","Near-IR wavelength providing optimal absorption balance for CMC ceramic phases and contaminants"
"spotSize","50","μm","0.1","500","Beam spot diameter optimized for precision cleaning of CMC surface features"
"repetitionRate","100","kHz","1","200","High repetition rate for efficient area coverage while maintaining thermal management"
"energyDensity","5","J/cm²","0.1","20","Fluence level sufficient for contaminant ablation while below CMC damage threshold"
"pulseWidth","10","ns","0.1","1000","Nanosecond pulse duration for efficient contaminant ablation with minimal thermal diffusion into CMC substrate"
"scanSpeed","500","mm/s","10","5000","Optimal scanning speed for uniform contaminant removal across CMC surfaces"
"passCount","2","passes","1","10","Number of cleaning passes for thorough contaminant removal with process control"
"overlapRatio","50","%","10","90","Beam overlap percentage ensuring complete coverage without excessive heat accumulation"