Parameter,Value,Unit,Min,Max,Description
"powerRange","100","W","1","120","Optimal average power for Chromium oxide removal without substrate damage"
"wavelength","1064","nm","355","10640","Near-IR wavelength with good Chromium absorption for efficient cleaning"
"spotSize","50","μm","0.1","500","Beam spot diameter for precise Chromium surface cleaning"
"repetitionRate","50","kHz","1","200","Optimal repetition rate for efficient Chromium cleaning throughput"
"fluenceThreshold","2.5","J/cm²","0.3","4.5","Minimum fluence required for effective Chromium oxide removal"
"pulseWidth","10","ns","0.1","1000","Nanosecond pulse duration for effective Chromium oxide ablation"
"scanSpeed","500","mm/s","10","5000","Optimal scanning speed for uniform Chromium surface treatment"
"passCount","3","passes","1","10","Recommended number of passes for complete Chromium oxide removal"
"overlapRatio","50","%","10","90","Optimal beam overlap for uniform Chromium surface cleaning"