Parameter,Value,Unit,Min,Max,Description
"powerRange","45","W","1","120","Optimal average power for Europium oxide layer removal"
"wavelength","532","nm","355","10640","Green wavelength for optimal Europium absorption"
"spotSize","50","μm","0.1","500","Beam spot diameter for precise cleaning"
"repetitionRate","50","kHz","1","200","Optimal repetition rate for efficient cleaning"
"fluenceThreshold","1.2","J/cm²","0.3","4.5","Threshold fluence for Europium oxide removal"
"pulseWidth","8","ns","0.1","1000","Nanosecond pulse width for controlled ablation"
"scanSpeed","500","mm/s","10","5000","Optimal scanning speed for uniform cleaning"
"passCount","2","passes","1","10","Number of cleaning passes required"
"overlapRatio","50","%","10","90","Optimal beam overlap for complete coverage"