Parameter,Value,Unit,Min,Max,Description
"powerRange","45","W","1","120","Optimal average power for Gallium oxide removal without excessive melting"
"wavelength","1064","nm","355","10640","Near-IR wavelength for moderate Gallium absorption with good penetration"
"spotSize","80","μm","0.1","500","Optimal spot diameter for precise cleaning of Gallium surfaces"
"repetitionRate","50","kHz","1","200","Balanced repetition rate for efficient cleaning with thermal management"
"fluenceThreshold","1.2","J/cm²","0.3","4.5","Minimum fluence required for effective Gallium oxide removal"
"pulseWidth","15","ns","0.1","1000","Nanosecond pulses for controlled ablation of surface contaminants"
"scanSpeed","500","mm/s","10","5000","Scan speed for efficient area coverage while maintaining cleaning effectiveness"
"passCount","2","passes","1","10","Number of passes for complete contaminant removal without substrate damage"
"overlapRatio","50","%","10","90","Optimal overlap between adjacent laser tracks for uniform cleaning"