Parameter,Value,Unit,Min,Max,Description
"powerRange","100","W","1","120","Optimal average power for Hafnium oxide removal without substrate damage"
"wavelength","1064","nm","355","10640","Near-IR wavelength optimized for Hafnium's absorption characteristics"
"spotSize","50","μm","0.1","500","Beam spot diameter for precise cleaning resolution"
"repetitionRate","50","kHz","1","200","Optimal repetition rate for continuous cleaning coverage"
"fluenceThreshold","2.5","J/cm²","0.3","4.5","Minimum fluence required for effective Hafnium oxide removal"
"pulseWidth","10","ns","0.1","1000","Nanosecond pulse duration for efficient oxide layer ablation"
"scanSpeed","500","mm/s","10","5000","Optimal scanning speed for uniform surface treatment"
"passCount","3","passes","1","10","Recommended number of passes for complete oxide removal"
"overlapRatio","50","%","10","90","Optimal beam overlap for uniform cleaning coverage"