Parameter,Value,Unit,Min,Max,Description
"powerRange","45","W","1","120","Optimal average power for Iridium surface cleaning without thermal damage"
"wavelength","1064","nm","355","10640","Fundamental Nd:YAG wavelength with good Iridium absorption"
"spotSize","50","μm","0.1","500","Beam spot diameter for precise cleaning control"
"repetitionRate","50","kHz","1","200","Optimal repetition rate for continuous cleaning coverage"
"fluenceThreshold","2.5","J/cm²","0.3","4.5","Minimum fluence required for effective Iridium surface cleaning"
"pulseWidth","8","ns","0.1","1000","Short pulse duration for efficient ablation with minimal heat diffusion"
"scanSpeed","500","mm/s","10","5000","Optimal scanning speed for efficient area coverage"
"passCount","3","passes","1","10","Recommended number of passes for complete contamination removal"
"overlapRatio","50","%","10","90","Optimal beam overlap for uniform cleaning results"