Parameter,Value,Unit,Min,Max,Description
"powerRange","100","W","1","120","Optimal average power for Nickel oxide and contaminant removal"
"wavelength","1064","nm","355","10640","Near-IR wavelength for efficient Nickel processing with good absorption"
"spotSize","50","μm","0.1","500","Optimal beam diameter for precision cleaning"
"repetitionRate","100","kHz","1","200","High repetition rate for efficient cleaning coverage"
"fluenceThreshold","2.5","J/cm²","0.3","4.5","Minimum fluence required for effective Nickel contaminant removal"
"pulseWidth","10","ns","0.1","1000","Nanosecond pulse duration for effective contaminant ablation without substrate damage"
"scanSpeed","500","mm/s","10","5000","Scanning speed for efficient area coverage"
"passCount","3","passes","1","10","Number of cleaning passes for complete contaminant removal"
"overlapRatio","50","%","10","90","Optimal overlap between adjacent scan lines for uniform cleaning"
"power","100","W","20","300","Typical range for pulsed fiber lasers at 1064 nm used in industrial cleaning of reflective metals like nickel; starting at 100 W balances efficiency and safety to avoid thermal damage due to nickel's high reflectivity (~60% at 1064 nm) and thermal conductivity (90 W/m·K). Max safe before substrate melting (1455°C) is ~300 W with short pulses. Source: IPG Photonics YLR series specs and study in Optics and Lasers in Engineering (2018) on metal surface cleaning."
"scan_speed","1500","mm/s","10","5000","Effective range for contamination removal on nickel; slower for heavy oxides (500-1000 mm/s) to ensure ablation, faster for light contaminants (2000-3000 mm/s). Recommended 1500 mm/s for optimal balance of throughput and uniform cleaning without excessive heat buildup. Source: Industry standards from Laserax equipment manuals and Journal of Laser Applications (2020) case study on nickel alloys."
"pulse_width","50","ns","0.1","1000","Nanosecond regime (10-200 ns) is typical and cost-effective for nickel cleaning at 1064 nm; picosecond (ps) or femtosecond (fs) reduces heat-affected zone (HAZ <1 μm) but is unnecessary for most industrial apps. Recommended 50 ns for minimal HAZ (~5-10 μm) on nickel's reflective surface. Source: Laser physics research in Applied Surface Science (2019) comparing pulse regimes for metals."
"repetition_rate","30","kHz","1","200","Typical 10-100 kHz for pulsed cleaning; higher rates (>50 kHz) speed up process but increase heat accumulation on nickel due to its conductivity, risking subsurface damage. Recommended 30 kHz for nickel to optimize energy delivery without overheating. Source: Academic literature in Lasers in Manufacturing and Materials Processing (2021) on frequency effects in metal ablation."
"energy_density","1.5","J/cm²","0.1","20","Fluence range for safe contaminant removal; nickel's ablation threshold at 1064 nm is ~1-2 J/cm² due to high reflectivity, with damage threshold ~4-6 J/cm² to avoid melting. Recommended 1.5 J/cm² for effective cleaning below damage threshold. Source: Ablation threshold studies in Journal of Applied Physics (2017) and Optics Express (2022) on nickel surfaces."
"spot_size","200","μm","0.1","500","Beam diameter range for cleaning; smaller (50-100 μm) for fine details, larger (300-500 μm) for broad areas. Recommended 200 μm for nickel to achieve uniform fluence distribution and control heat input on reflective surfaces. Source: Equipment specifications from Coherent and Trumpf laser systems, per industrial cleaning guidelines."
"pass_count","2","passes","1","10","Single pass for light contamination, multi-pass (2-5) for heavy layers to ensure complete removal without exceeding damage thresholds. Recommended 2 passes for nickel in industrial prep to minimize thermal stress. Source: Industry practice in case studies from Surface and Coatings Technology (2019) on nickel oxide removal."
"overlap_ratio","60","%","10","90","Typical 30-80% for uniform coverage; higher overlap ensures no gaps but increases heat exposure on nickel. Recommended 60% for balanced uniformity and efficiency in scan line coverage. Source: Process optimization studies in International Journal of Advanced Manufacturing Technology (2020) for laser cleaning of metals."