Parameter,Value,Unit,Min,Max,Description
"powerRange","100","W","1","120","Optimal average power range for Polytetrafluoroethylene surface cleaning without thermal degradation"
"wavelength","1064","nm","355","10640","Near-infrared wavelength optimized for Polytetrafluoroethylene absorption characteristics and minimal subsurface damage"
"spotSize","50","μm","0.1","500","Beam spot diameter for precise Polytetrafluoroethylene surface cleaning resolution"
"repetitionRate","50","kHz","1","200","Optimal repetition rate for efficient Polytetrafluoroethylene cleaning with thermal management"
"energyDensity","5.1","J/cm²","0.1","20","Fluence threshold for effective Polytetrafluoroethylene contaminant removal without substrate damage"
"pulseWidth","10","ns","0.1","1000","Nanosecond pulse duration for controlled ablation of Polytetrafluoroethylene surface contaminants"
"scanSpeed","500","mm/s","10","5000","Optimal scanning speed for uniform Polytetrafluoroethylene surface treatment"
"passCount","3","passes","1","10","Recommended number of passes for complete Polytetrafluoroethylene surface cleaning"
"overlapRatio","50","%","10","90","Optimal beam overlap for uniform Polytetrafluoroethylene surface coverage"