Parameter,Value,Unit,Min,Max,Description
"powerRange","15","W","1","120","Optimal average power for Polycarbonate surface cleaning without thermal damage"
"wavelength","1064","nm","355","10640","Near-IR wavelength providing good absorption in contaminants while minimizing Polycarbonate substrate damage"
"spotSize","50","μm","0.1","500","Beam spot diameter for precise cleaning with sufficient energy density"
"repetitionRate","20","kHz","1","200","Optimal repetition rate for efficient cleaning with adequate cooling between pulses"
"fluenceThreshold","0.8","J/cm²","0.3","4.5","Fluence threshold for contaminant removal while preserving Polycarbonate substrate"
"pulseWidth","100","ns","0.1","1000","Nanosecond pulse duration for effective contaminant removal with controlled thermal penetration"
"scanSpeed","500","mm/s","10","5000","Optimal scanning speed for uniform cleaning coverage"
"passCount","2","passes","1","10","Recommended number of passes for complete contaminant removal"
"overlapRatio","50","%","10","90","Optimal beam overlap for uniform cleaning without excessive thermal buildup"