Parameter,Value,Unit,Min,Max,Description
"powerRange","90","W","1","120","Optimal average power for Schist surface cleaning without thermal damage"
"wavelength","1064","nm","355","10640","Near-IR wavelength optimized for Schist mineral absorption characteristics"
"spotSize","80","μm","0.1","500","Beam spot diameter for precise cleaning control on Schist mineral layers"
"repetitionRate","50","kHz","1","200","Optimal repetition rate for efficient cleaning coverage on Schist surfaces"
"energyDensity","4.5","J/cm²","0.1","20","Fluence threshold for effective contaminant ablation without damaging Schist substrate"
"pulseWidth","12","ns","0.1","1000","Nanosecond pulse duration for effective contaminant removal with minimal substrate damage"
"scanSpeed","500","mm/s","10","5000","Optimal scanning speed for uniform cleaning across Schist surface variations"
"passCount","2","passes","1","10","Recommended number of passes for thorough cleaning of Schist mineral layers"
"overlapRatio","50","%","10","90","Optimal beam overlap percentage for complete coverage on uneven Schist surfaces"