Parameter,Value,Unit,Min,Max,Description
"powerRange","100","W","1","120","Optimal average power for Stucco surface cleaning without substrate damage"
"wavelength","1064","nm","355","10640","Near-infrared wavelength optimized for Stucco absorption and minimal substrate interaction"
"spotSize","0.2","mm","0.1","500","Beam spot diameter for balanced cleaning efficiency and resolution"
"repetitionRate","50","kHz","1","200","Optimal repetition rate for efficient cleaning coverage and process speed"
"energyDensity","3.2","J/cm²","0.1","20","Fluence threshold for effective Stucco surface cleaning"
"pulseWidth","10","ns","0.1","1000","Nanosecond pulse duration for effective contaminant removal with controlled thermal effects"
"scanSpeed","500","mm/s","10","5000","Optimal scanning speed for uniform cleaning without thermal accumulation"
"passCount","2","passes","1","10","Recommended number of passes for complete contaminant removal"
"overlapRatio","50","%","10","90","Optimal beam overlap for uniform cleaning coverage"