Parameter,Value,Unit,Min,Max,Description
"powerRange","45","W","1","120","Optimal average power for Tin oxide removal without substrate damage"
"wavelength","1064","nm","355","10640","Near-IR wavelength for efficient Tin oxide absorption with minimal substrate heating"
"spotSize","80","μm","0.1","500","Beam spot diameter for precise Tin surface cleaning"
"repetitionRate","50","kHz","1","200","Optimal repetition rate for efficient Tin cleaning with thermal management"
"fluenceThreshold","2.5","J/cm²","0.3","4.5","Minimum fluence required for Tin oxide ablation threshold"
"pulseWidth","12","ns","0.1","1000","Nanosecond pulse duration for controlled Tin oxide ablation"
"scanSpeed","500","mm/s","10","5000","Optimal scanning speed for uniform Tin oxide removal"
"passCount","2","passes","1","10","Recommended number of passes for complete Tin oxide removal"
"overlapRatio","50","%","10","90","Optimal beam overlap for uniform Tin surface cleaning"