"Campaign","Ad Group","Headline 1","Headline 2","Headline 3","Description 1","Description 2","Final URL"
"Core Services - Laser Cleaning","Laser Cleaning - Broad","Professional Laser Cleaning","Industrial Cleaning Services","$390/Hour • Mobile Service","Eco-friendly laser cleaning for rust, paint, coatings. No chemicals, no waste. Free quote.","Serving manufacturers nationwide. Mobile service available. Same-day response.","https://z-beam.com/services/professional-cleaning"
"Core Services - Laser Cleaning","Rust Removal","Laser Rust Removal Services","Remove Rust Without Damage","$390/Hr • Fast & Effective","Advanced laser rust removal for steel, iron, metal surfaces. No abrasives. No chemicals.","Precision rust removal without substrate damage. Mobile service nationwide. Free estimate.","https://z-beam.com/services/professional-cleaning?focus=rust-removal"
"Core Services - Laser Cleaning","Paint Stripping","Laser Paint Removal Services","Strip Paint & Coatings Fast","$390/Hr • Chemical-Free","Selective laser paint stripping for industrial applications. Remove coatings without chemicals.","Precision paint removal from metal, concrete, more. Mobile service available. Free quote.","https://z-beam.com/services/professional-cleaning?focus=paint-removal"
"Core Services - Laser Cleaning","Industrial Cleaning","Industrial Surface Cleaning","Pre-Weld Cleaning Services","$390/Hr • Manufacturer-Trusted","Professional surface prep for welding, bonding, coating. No damage to substrate.","Trusted by manufacturers for precision cleaning. Mobile service. Same-day availability.","https://z-beam.com/services/professional-cleaning?focus=industrial"
"Core Services - Laser Cleaning","Equipment Rental","Laser Cleaning Equipment Rental","Rent Industrial Laser Cleaners","$320/Hour • Flexible Terms","Rent professional laser cleaning equipment. Training included. Daily, weekly, monthly rates.","High-power laser cleaners for rent. Operator training provided. Nationwide delivery.","https://z-beam.com/rental"
"Material-Specific Cleaning","Metal Cleaning","Laser Metal Cleaning Services","Steel • Aluminum • Titanium","$390/Hr • Precision Cleaning","Specialized laser cleaning for all metals. No surface damage. Remove rust, paint, oxides.","Clean steel, aluminum, stainless, exotic alloys. Mobile service nationwide. Free estimate.","https://z-beam.com/services/professional-cleaning?material=metal"
"Material-Specific Cleaning","Stone & Concrete","Laser Stone Cleaning Services","Monument & Facade Restoration","$390/Hr • Historic Preservation","Gentle laser cleaning for stone, marble, granite, concrete. Preserve historic surfaces.","Professional stone restoration services. No damage to original surface. Free consultation.","https://z-beam.com/services/professional-cleaning?material=stone"
"Material-Specific Cleaning","Wood & Composite","Laser Wood Cleaning Services","Composite Material Restoration","$390/Hr • Gentle & Precise","Specialized laser cleaning for wood, composites, carbon fiber. No heat damage.","Professional restoration for wood and composite materials. Mobile service available.","https://z-beam.com/services/professional-cleaning?material=wood"
"Competitor & High-Intent","Alternative Methods","Better Than Sandblasting","Eco-Friendly Laser Cleaning","$390/Hr • No Chemicals","Laser cleaning eliminates abrasives, chemicals, waste. Safer, faster, more precise.","Replace sandblasting and chemical stripping with laser technology. Free demonstration.","https://z-beam.com/services/professional-cleaning?focus=eco-friendly"
"Competitor & High-Intent","Local Services","Mobile Laser Cleaning Service","Local Industrial Cleaning","$390/Hr • Same-Day Response","Professional laser cleaning at your location. Serving [LOCATION] and surrounding areas.","Mobile industrial cleaning services. On-site demonstrations available. Free quote.","https://z-beam.com/services/professional-cleaning?mobile=true"